{
  "id": "art_kb_upload_demo_corp_001",
  "schema_version": "1",
  "type": "kb_upload_result",
  "status": "resolved",
  "source_tool_call_id": "tc_kb_upload_demo_corp_001",
  "owner_agent": "report",
  "title": "客户材料 KB 入库结果 · 沧澜精密机械 · 4 份材料",
  "version": 5,
  "patches": [
    {
      "id": "patch_kb_001_v1",
      "artifact_id": "art_kb_upload_demo_corp_001",
      "base_version": 0,
      "next_version": 1,
      "op": "replace",
      "path": "/upload_batch",
      "value": {
        "batch_id": "kb_batch_demo_corp_001",
        "uploader_persona": "RM 王哲(客户经理)",
        "submitted_at": "2026-05-11T08:50:00Z",
        "subject_id_hash": "a3f1b2c0d4e5f678",
        "doc_count_expected": 4
      },
      "ts": "2026-05-11T08:50:02Z"
    },
    {
      "id": "patch_kb_001_v2",
      "artifact_id": "art_kb_upload_demo_corp_001",
      "base_version": 1,
      "next_version": 2,
      "op": "append",
      "path": "/kb_docs",
      "value": {
        "id": "kbd_corp_001_audit_2024_q4",
        "schema_version": "1",
        "title": "沧澜精密机械 2024 年度合并审计报告(签字版)",
        "type": "upload",
        "tier": 2,
        "source_type": "user",
        "collected_at": "2026-05-11T08:50:18Z",
        "valid_until": "2027-06-30T00:00:00Z",
        "verification_method": "signature",
        "content_hash": "c4b3a29178f0e1d2c3b4a59687f0e1d2c3b4a59687f0e1d2c3b4a59687f0e1d2",
        "pipl_region": "cn"
      },
      "ts": "2026-05-11T08:50:18Z"
    },
    {
      "id": "patch_kb_001_v3",
      "artifact_id": "art_kb_upload_demo_corp_001",
      "base_version": 2,
      "next_version": 3,
      "op": "append",
      "path": "/kb_docs",
      "value": {
        "id": "kbd_corp_001_finance_ledger_2024",
        "schema_version": "1",
        "title": "2024 年度财务总账(管理层口径)",
        "type": "upload",
        "tier": 1,
        "source_type": "internal",
        "collected_at": "2026-05-11T08:51:02Z",
        "verification_method": "cross_check",
        "content_hash": "b5a4938271e6d5c4b3a29178e6d5c4b3a29178e6d5c4b3a29178e6d5c4b3a291",
        "pipl_region": "cn"
      },
      "ts": "2026-05-11T08:51:02Z"
    },
    {
      "id": "patch_kb_001_v4",
      "artifact_id": "art_kb_upload_demo_corp_001",
      "base_version": 3,
      "next_version": 4,
      "op": "append",
      "path": "/kb_docs",
      "value": {
        "id": "kbd_industry_c34_research_2026_q1",
        "schema_version": "1",
        "title": "通用设备制造业(C34)2026 一季度行业景气研究报告",
        "type": "pulled",
        "tier": 3,
        "source_type": "tavily",
        "collected_at": "2026-05-11T08:51:48Z",
        "verification_method": "manual",
        "content_hash": "a6b5c4d3e2f10987a6b5c4d3e2f10987a6b5c4d3e2f10987a6b5c4d3e2f10987",
        "pipl_region": "cn"
      },
      "ts": "2026-05-11T08:51:48Z"
    },
    {
      "id": "patch_kb_001_v5",
      "artifact_id": "art_kb_upload_demo_corp_001",
      "base_version": 4,
      "next_version": 5,
      "op": "append",
      "path": "/kb_docs",
      "value": {
        "id": "kbd_overseas_news_aerospace_supply_2025q4",
        "schema_version": "1",
        "title": "Reuters: Global Aerospace Supply Chain Outlook 2026 (scanned image)",
        "type": "pulled",
        "tier": 4,
        "source_type": "tavily",
        "collected_at": "2026-05-11T08:52:30Z",
        "verification_method": "unverified",
        "content_hash": "9f8e7d6c5b4a392817061f2e3d4c5b6a9f8e7d6c5b4a392817061f2e3d4c5b6a",
        "pipl_region": "overseas"
      },
      "ts": "2026-05-11T08:52:30Z"
    }
  ],
  "snapshot": {
    "upload_batch": {
      "batch_id": "kb_batch_demo_corp_001",
      "uploader_persona": "RM 王哲(客户经理)",
      "submitted_at": "2026-05-11T08:50:00Z",
      "subject_id_hash": "a3f1b2c0d4e5f678",
      "doc_count_expected": 4,
      "doc_count_resolved": 4,
      "elapsed_ms": 150421
    },
    "kb_docs": [
      {
        "id": "kbd_corp_001_audit_2024_q4",
        "schema_version": "1",
        "title": "沧澜精密机械 2024 年度合并审计报告(签字版)",
        "type": "upload",
        "tier": 2,
        "source_type": "user",
        "collected_at": "2026-05-11T08:50:18Z",
        "valid_until": "2027-06-30T00:00:00Z",
        "verification_method": "signature",
        "content_hash": "c4b3a29178f0e1d2c3b4a59687f0e1d2c3b4a59687f0e1d2c3b4a59687f0e1d2",
        "pipl_region": "cn",
        "_meta": {
          "file_type": "pdf",
          "file_size_bytes": 4218372,
          "page_count": 84,
          "evidence_date": "2025-04-22T00:00:00Z",
          "retrieved_at": "2026-05-11T08:50:18Z",
          "data_tier": 2,
          "source_url": "internal://upload/2026-05/cangulan-2024-audit-signed.pdf",
          "source_tier": "government"
        }
      },
      {
        "id": "kbd_corp_001_finance_ledger_2024",
        "schema_version": "1",
        "title": "2024 年度财务总账(管理层口径)",
        "type": "upload",
        "tier": 1,
        "source_type": "internal",
        "collected_at": "2026-05-11T08:51:02Z",
        "verification_method": "cross_check",
        "content_hash": "b5a4938271e6d5c4b3a29178e6d5c4b3a29178e6d5c4b3a29178e6d5c4b3a291",
        "pipl_region": "cn",
        "_meta": {
          "file_type": "xlsx",
          "file_size_bytes": 1872563,
          "sheet_count": 12,
          "evidence_date": "2025-03-14T00:00:00Z",
          "retrieved_at": "2026-05-11T08:51:02Z",
          "data_tier": 1,
          "source_url": "internal://crm/customer/a3f1b2c0d4e5f678/finance/2024-ledger.xlsx",
          "source_tier": "internal_authoritative"
        }
      },
      {
        "id": "kbd_industry_c34_research_2026_q1",
        "schema_version": "1",
        "title": "通用设备制造业(C34)2026 一季度行业景气研究报告",
        "type": "pulled",
        "tier": 3,
        "source_type": "tavily",
        "collected_at": "2026-05-11T08:51:48Z",
        "verification_method": "manual",
        "content_hash": "a6b5c4d3e2f10987a6b5c4d3e2f10987a6b5c4d3e2f10987a6b5c4d3e2f10987",
        "pipl_region": "cn",
        "_meta": {
          "file_type": "docx",
          "file_size_bytes": 936428,
          "page_count": 31,
          "evidence_date": "2026-04-08T00:00:00Z",
          "retrieved_at": "2026-05-11T08:51:48Z",
          "data_tier": 3,
          "source_url": "https://industry-research.example.cn/c34/2026q1-prosperity-report.docx",
          "source_tier": "industry"
        }
      },
      {
        "id": "kbd_overseas_news_aerospace_supply_2025q4",
        "schema_version": "1",
        "title": "Reuters: Global Aerospace Supply Chain Outlook 2026 (scanned image)",
        "type": "pulled",
        "tier": 4,
        "source_type": "tavily",
        "collected_at": "2026-05-11T08:52:30Z",
        "verification_method": "unverified",
        "content_hash": "9f8e7d6c5b4a392817061f2e3d4c5b6a9f8e7d6c5b4a392817061f2e3d4c5b6a",
        "pipl_region": "overseas",
        "_meta": {
          "file_type": "scanned_image",
          "file_size_bytes": 6724819,
          "page_count": 18,
          "ocr_applied": true,
          "ocr_confidence": 0.87,
          "evidence_date": "2025-11-12T00:00:00Z",
          "retrieved_at": "2026-05-11T08:52:30Z",
          "data_tier": 4,
          "source_url": "https://www.reuters.example.com/business/aerospace/global-supply-chain-2026-outlook.html",
          "source_tier": "public_web",
          "pipl_note": "海外公开 web 数据 · 入库时已脱敏处理 · 仅作为 Tier 4 背景参考 · 不作为核心 claim 来源(per root §3.5.1 第 6 原则 + §3.6 PIPL fallback chain · audit log 已记录 region=overseas)"
        }
      }
    ],
    "ingest_summary": {
      "by_tier": {"1": 1, "2": 1, "3": 1, "4": 1},
      "by_source_type": {"user": 1, "internal": 1, "tavily": 2},
      "by_verification_method": {"signature": 1, "cross_check": 1, "manual": 1, "unverified": 1},
      "by_file_type": {"pdf": 1, "xlsx": 1, "docx": 1, "scanned_image": 1},
      "by_pipl_region": {"cn": 3, "overseas": 1},
      "core_claim_eligible_count": 3,
      "core_claim_blocked_count": 1,
      "core_claim_blocked_reason_note": "kbd_overseas_news_aerospace_supply_2025q4 (Tier 4 public_web · pipl_region=overseas) 不能作为核心 claim 单一来源 · 需 Tier 2-3 交叉佐证"
    },
    "ledger": {
      "decision_id": "ledger_kb_upload_demo_corp_001",
      "jurisdiction": "HQ",
      "retention_class": "standard",
      "idempotency_key": "kb_upload:report:a3f1b2c0d4e5f678:2026-05-11T08:50:00Z",
      "input_hash": "5e4d3c2b1a09f8e7d6c5b4a3928170615e4d3c2b1a09f8e7d6c5b4a392817061",
      "output_hash": "6f5e4d3c2b1a09f8e7d6c5b4a392817066f5e4d3c2b1a09f8e7d6c5b4a392817"
    }
  },
  "verdict": "PASS",
  "qc_score": {
    "passed": 9,
    "total": 9
  },
  "evidence_refs": [],
  "created_at": "2026-05-11T08:50:00Z",
  "updated_at": "2026-05-11T08:52:30Z",
  "resolved_at": "2026-05-11T08:52:30Z"
}
